{
  "$schema": "./schemas/repository-licenses.schema.json",
  "schemaVersion": 1,
  "lastVerified": "2026-10-17",
  "statusOwner": "elixpo",
  "entries": {
    "accounts.elixpo": { "detection": "NOASSERTION", "classification": "custom-mixed", "spdxId": null, "evidenceUrl": "https://github.com/elixpo/accounts.elixpo/blob/main/LICENSE", "summary": "The repository publishes custom mixed code, asset, and trademark terms. Read the controlling file; no universal open-source grant is inferred.", "verifiedAt": "2026-10-17" },
    "admin.elixpo": { "detection": "NOASSERTION", "classification": "custom-mixed", "spdxId": null, "evidenceUrl": "https://github.com/elixpo/admin.elixpo/blob/main/LICENSE", "summary": "The repository publishes custom mixed code, asset, and trademark terms. Read the controlling file; no universal open-source grant is inferred.", "verifiedAt": "2026-10-17" },
    "agent.elixpo": { "detection": "NOASSERTION", "classification": "custom-mixed", "spdxId": null, "evidenceUrl": "https://github.com/elixpo/agent.elixpo/blob/main/LICENSE", "summary": "The repository publishes custom mixed code, asset, and trademark terms. Read the controlling file; no universal open-source grant is inferred.", "verifiedAt": "2026-10-17" },
    "art.elixpo": { "detection": "NOASSERTION", "classification": "custom-mixed", "spdxId": null, "evidenceUrl": "https://github.com/elixpo/art.elixpo/blob/main/LICENSE", "summary": "The archived repository retains its custom mixed terms. Inspect the license before reuse; archival does not create additional permission.", "verifiedAt": "2026-10-17" },
    "blogs.elixpo": { "detection": "NOASSERTION", "classification": "custom-mixed", "spdxId": null, "evidenceUrl": "https://github.com/elixpo/blogs.elixpo/blob/main/LICENSE", "summary": "The repository publishes custom mixed code, asset, and trademark terms. Read the controlling file; no universal open-source grant is inferred.", "verifiedAt": "2026-10-17" },
    "chat.elixpo": { "detection": "NOASSERTION", "classification": "custom-mixed", "spdxId": null, "evidenceUrl": "https://github.com/elixpo/chat.elixpo/blob/main/LICENSE", "summary": "The archived repository retains its custom mixed terms. Inspect the license before reuse; archival does not create additional permission.", "verifiedAt": "2026-10-17" },
    "claudeOps.elixpo": { "detection": "MIT", "classification": "spdx-recognized", "spdxId": "MIT", "evidenceUrl": "https://github.com/elixpo/claudeOps.elixpo/blob/main/LICENSE", "summary": "GitHub currently detects an MIT repository license. The license file remains the controlling evidence for reuse.", "verifiedAt": "2026-10-17" },
    "clock.elixpo": { "detection": "MISSING", "classification": "missing", "spdxId": null, "evidenceUrl": null, "summary": "No repository-level license is currently detected. The source may be inspected, but no reuse permission should be inferred.", "verifiedAt": "2026-10-17" },
    "crumb.elixpo": { "detection": "NOASSERTION", "classification": "custom-mixed", "spdxId": null, "evidenceUrl": "https://github.com/elixpo/crumb.elixpo/blob/main/LICENSE", "summary": "The repository publishes custom mixed code, asset, and trademark terms. Read the controlling file; no universal open-source grant is inferred.", "verifiedAt": "2026-10-17" },
    "cypher": { "detection": "MIT", "classification": "spdx-recognized", "spdxId": "MIT", "evidenceUrl": "https://github.com/elixpo/cypher/blob/main/LICENSE", "summary": "The Cypher application source is released under the MIT License. Elixpo names and marks remain subject to the separate trademark policy.", "verifiedAt": "2026-10-17" },
    "elixpo_chapter": { "detection": "NOASSERTION", "classification": "custom-mixed", "spdxId": null, "evidenceUrl": "https://github.com/elixpo/elixpo_chapter/blob/main/LICENSE", "summary": "The repository publishes custom mixed code, asset, and trademark terms. Read the controlling file; no universal open-source grant is inferred.", "verifiedAt": "2026-10-17" },
    "emoji_transnetv1": { "detection": "MISSING", "classification": "missing", "spdxId": null, "evidenceUrl": null, "summary": "No repository-level license is currently detected. Individual model artifacts may publish separate terms, but no source-code reuse permission is inferred.", "verifiedAt": "2026-10-17" },
    "falcon": { "detection": "MISSING", "classification": "missing", "spdxId": null, "evidenceUrl": null, "summary": "No repository-level license is currently detected. The experimental history may be inspected, but no reuse permission should be inferred.", "verifiedAt": "2026-10-17" },
    "flappy6502": { "detection": "MIT", "classification": "spdx-recognized", "spdxId": "MIT", "evidenceUrl": "https://github.com/elixpo/flappy6502/blob/master/LICENSE", "summary": "GitHub currently detects an MIT repository license. The license file controls the released source and documented project material within its scope.", "verifiedAt": "2026-10-28" },
    "jackey.elixpo": { "detection": "MISSING", "classification": "missing", "spdxId": null, "evidenceUrl": null, "summary": "No repository-level license is currently detected. The archived source may be inspected, but no reuse permission should be inferred.", "verifiedAt": "2026-10-17" },
    "Kareixo": { "detection": "MIT", "classification": "spdx-recognized", "spdxId": "MIT", "evidenceUrl": "https://github.com/elixpo/Kareixo/blob/main/LICENSE", "summary": "The transferred Member Project retains its MIT license. Joining Elixpo does not change its existing grant or maintainer authority.", "verifiedAt": "2026-10-17" },
    "lixrl.com": { "detection": "NOASSERTION", "classification": "custom-mixed", "spdxId": null, "evidenceUrl": "https://github.com/elixpo/lixrl.com/blob/main/LICENSE", "summary": "The repository publishes custom mixed code, asset, and trademark terms. Read the controlling file; no universal open-source grant is inferred.", "verifiedAt": "2026-10-17" },
    "mails.elixpo": { "detection": "NOASSERTION", "classification": "custom-mixed", "spdxId": null, "evidenceUrl": "https://github.com/elixpo/mails.elixpo/blob/main/LICENSE", "summary": "The repository publishes custom mixed code, asset, and trademark terms. Read the controlling file; no universal open-source grant is inferred.", "verifiedAt": "2026-10-17" },
    "me.elixpo": { "detection": "NOASSERTION", "classification": "custom-mixed", "spdxId": null, "evidenceUrl": "https://github.com/elixpo/me.elixpo/blob/main/LICENSE", "summary": "The repository publishes custom mixed code, asset, and trademark terms. Read the controlling file; no universal open-source grant is inferred.", "verifiedAt": "2026-10-17" },
    "monodiffuse": { "detection": "MIT", "classification": "spdx-recognized", "spdxId": "MIT", "evidenceUrl": "https://github.com/elixpo/monodiffuse/blob/main/LICENSE", "summary": "GitHub currently detects an MIT repository license. Papers, models, and other research artifacts may publish additional artifact-specific terms.", "verifiedAt": "2026-10-17" },
    "Nano28C64": { "detection": "MIT", "classification": "spdx-recognized", "spdxId": "MIT", "evidenceUrl": "https://github.com/elixpo/Nano28C64/blob/main/LICENSE", "summary": "GitHub currently detects an MIT repository license. The license file controls the released source and documented project material within its scope.", "verifiedAt": "2026-10-17" },
    "octabit": { "detection": "MIT", "classification": "spdx-recognized", "spdxId": "MIT", "evidenceUrl": "https://github.com/elixpo/octabit/blob/main/LICENSE", "summary": "GitHub currently detects an MIT repository license. The separately published paper retains its own stated publication terms.", "verifiedAt": "2026-10-17" },
    "opensource.elixpo": { "detection": "NOASSERTION", "classification": "custom-mixed", "spdxId": null, "evidenceUrl": "https://github.com/elixpo/opensource.elixpo/blob/main/LICENSE", "summary": "The repository publishes custom mixed code, asset, and trademark terms. Read the controlling file; no universal open-source grant is inferred.", "verifiedAt": "2026-10-17" },
    "oreo": { "detection": "NOASSERTION", "classification": "custom-mixed", "spdxId": null, "evidenceUrl": "https://github.com/elixpo/oreo/blob/main/LICENSE", "summary": "Oreo publishes custom code, hardware, asset, upstream-component, and trademark terms. Permission must be evaluated for the specific artifact being reused.", "verifiedAt": "2026-10-17" },
    "oreoPI": { "detection": "NOASSERTION", "classification": "custom-mixed", "spdxId": null, "evidenceUrl": "https://github.com/elixpo/oreoPI/blob/main/LICENSE", "summary": "The repository publishes custom mixed code, asset, and trademark terms. Read the controlling file; no universal open-source grant is inferred.", "verifiedAt": "2026-10-17" },
    "packages.elixpo": { "detection": "MIT", "classification": "spdx-recognized", "spdxId": "MIT", "evidenceUrl": "https://github.com/elixpo/packages.elixpo/blob/main/LICENSE", "summary": "GitHub currently detects an MIT repository license. Distributed applications and upstream packages retain their own controlling licenses.", "verifiedAt": "2026-10-17" },
    "payouts.elixpo": { "detection": "NOASSERTION", "classification": "custom-mixed", "spdxId": null, "evidenceUrl": "https://github.com/elixpo/payouts.elixpo/blob/main/LICENSE", "summary": "The repository publishes custom mixed code, asset, and trademark terms. Read the controlling file; no universal open-source grant is inferred.", "verifiedAt": "2026-10-17" },
    "qfabric": { "detection": "Apache-2.0", "classification": "spdx-recognized", "spdxId": "Apache-2.0", "evidenceUrl": "https://github.com/elixpo/qfabric/blob/main/LICENSE", "summary": "GitHub currently detects Apache-2.0 for the software. The unpublished manuscript and original figures retain separately recorded terms.", "verifiedAt": "2026-10-17" },